Gene_set,Term,Overlap,P-value,Adjusted P-value,Old P-value,Old Adjusted P-value,Odds Ratio,Combined Score,Genes
Reactome_2016,Transmembrane transport of small molecules Homo sapiens R-HSA-382551,1/594,0.2603424962072657,0.2761208293107363,0,0,3.634438823308975,4.891072293407957,CAMK2D
Reactome_2016,Cytokine Signaling in Immune system Homo sapiens R-HSA-1280215,1/620,0.2701950902055904,0.2844158844269372,0,0,3.4771136241249327,4.550189222264238,CAMK2D
Reactome_2016,Metabolism of lipids and lipoproteins Homo sapiens R-HSA-556833,1/659,0.284752610948754,0.2975027278569072,0,0,3.264437689969605,4.100572829725793,ELOVL5
Reactome_2016,Adaptive Immune System Homo sapiens R-HSA-1280218,1/762,0.3219513469702059,0.3338754709320653,0,0,2.8075631479048035,3.181965285708084,RLIM
Reactome_2016,Developmental Biology Homo sapiens R-HSA-1266738,1/786,0.330364828857393,0.3400814414708457,0,0,2.718329794762916,3.0107070768200503,CAMK2D
Reactome_2016,Innate Immune System Homo sapiens R-HSA-168249,1/807,0.3376494226073071,0.3450432055841095,0,0,2.644609870416322,2.871377584697174,CAMK2D
Reactome_2016,Signal Transduction Homo sapiens R-HSA-162582,2/2465,0.3543407333108205,0.3594761062573541,0,0,1.7790296386520503,1.8457366771209824,CAMK2D;MIB1
Reactome_2016,Signaling by GPCR Homo sapiens R-HSA-372790,1/1293,0.4875228793590807,0.4910302382033906,0,0,1.608015135878913,1.1552271105527534,CAMK2D
Reactome_2016,Metabolism Homo sapiens R-HSA-1430728,1/1908,0.6331710096822573,0.6331710096822573,0,0,1.0536036823399173,0.4815124085730582,ELOVL5
