Gene_set,Term,Overlap,P-value,Adjusted P-value,Old P-value,Old Adjusted P-value,Odds Ratio,Combined Score,Genes
Reactome_2016,Innate Immune System Homo sapiens R-HSA-168249,1/807,0.3376494226073071,0.3504098328941103,0,0,2.644609870416322,2.871377584697174,CREB1
Reactome_2016,Generic Transcription Pathway Homo sapiens R-HSA-212436,1/812,0.3393733027242171,0.3504098328941103,0,0,2.627620221948212,2.839549852278202,ZNF71
Reactome_2016,Metabolism of proteins Homo sapiens R-HSA-392499,1/1074,0.4242507600050837,0.4345148912955293,0,0,1.9588899244071656,1.6796121308199985,RAB1A
Reactome_2016,Signaling by GPCR Homo sapiens R-HSA-372790,1/1293,0.4875228793590807,0.495323245428826,0,0,1.608015135878913,1.1552271105527534,CREB1
Reactome_2016,Immune System Homo sapiens R-HSA-168256,1/1547,0.5530194941880323,0.5574085377926992,0,0,1.325571366968521,0.7852181410552321,CREB1
Reactome_2016,Gene Expression Homo sapiens R-HSA-74160,1/1631,0.5729594546808433,0.5729594546808433,0,0,1.2515337423312884,0.697029608564523,ZNF71
